{
  "total_entities": 200,
  "entities_synced": 190,
  "entities_deleted": 10,
  "total_conflicts": 154,
  "conflicts_resolved_local": 79,
  "conflicts_resolved_remote": 75,
  "local_events_processed": 381,
  "remote_events_processed": 298,
  "duplicate_events_dropped": 8,
  "entities_with_conflicts": 80
}
